ssword: ***********
Welcome to the MySQL monitor.  Commands end with ; or \g.
Your MySQL connection id is 18
Server version: 8.0.46 MySQL Community Server - GPL

Copyright (c) 2000, 2026, Oracle and/or its affiliates.

Oracle is a registered trademark of Oracle Corporation and/or its
affiliates. Other names may be trademarks of their respective
owners.

Type 'help;' or '\h' for help. Type '\c' to clear the current input statement.

mysql> CREATE TABLE Products (
    ->  id INT,
    ->  name VARCHAR(100),
    ->  price DECIMAL(10,2),
    ->  qty INT
    ->  );
ERROR 1046 (3D000): No database selected
mysql> use da6;
Database changed
mysql> desc products;
ERROR 1146 (42S02): Table 'da6.products' doesn't exist
mysql> CREATE TABLE Products (
    ->  id INT,
    ->  name VARCHAR(100),
    ->  price DECIMAL(10,2),
    ->  qty INT
    ->  );
Query OK, 0 rows affected (0.04 sec)

mysql> drop table products;
Query OK, 0 rows affected (0.04 sec)
mysql> CREATE TABLE Products (
    ->  id INT,
    ->  name VARCHAR(100),
    ->  price DECIMAL(10,2),
    ->  qty INT
    ->  );
Query OK, 0 rows affected (0.06 sec)

mysql>
mysql>
mysql> INSERT INTO Products VALUES
    ->  (1, 'Pen', 10.00, 100),
    ->  (2, 'Notebook', 25.00, 50),
    ->  (3, 'Pencil', 5.00, 200),
    ->  (4, 'Eraser', 3.00, 300),
    ->  (5, 'Marker', 15.00, 80),
    ->  (6, 'Scale', 20.00, 150),
    ->  (7, 'Sharpener', 8.00, 120),
    ->  (8, 'Geometry Box', 120.00, 40),
    ->  (9, 'Sketch Pen', 60.00, 75),
    ->  (10, 'Crayons', 90.00, 55);^C
mysql> CREATE TABLE Products (
    ->  id INT,
    ->  name VARCHAR(100),
    ->  price DECIMAL(10,2),
    ->  qty INT
    ->  );
ERROR 1050 (42S01): Table 'products' already exists
mysql>
mysql>
mysql> INSERT INTO Products VALUES
    ->  (1, 'Pen', 10.00, 100),
    ->  (2, 'Notebook', 25.00, 50),
    ->  (3, 'Pencil', 5.00, 200),
    ->  (4, 'Eraser', 3.00, 300),
    ->  (5, 'Marker', 15.00, 80),
    ->  (6, 'Scale', 20.00, 150),
    ->  (7, 'Sharpener', 8.00, 120),
    ->  (8, 'Geometry Box', 120.00, 40),
    ->  (9, 'Sketch Pen', 60.00, 75),
    ->  (10, 'Crayons', 90.00, 55);
Query OK, 10 rows affected (0.04 sec)
Records: 10  Duplicates: 0  Warnings: 0

mysql> select * from products;
+------+--------------+--------+------+
| id   | name         | price  | qty  |
+------+--------------+--------+------+
|    1 | Pen          |  10.00 |  100 |
|    2 | Notebook     |  25.00 |   50 |
|    3 | Pencil       |   5.00 |  200 |
|    4 | Eraser       |   3.00 |  300 |
|    5 | Marker       |  15.00 |   80 |
|    6 | Scale        |  20.00 |  150 |
|    7 | Sharpener    |   8.00 |  120 |
|    8 | Geometry Box | 120.00 |   40 |
|    9 | Sketch Pen   |  60.00 |   75 |
|   10 | Crayons      |  90.00 |   55 |
+------+--------------+--------+------+
10 rows in set (0.00 sec)

mysql> desc products;
+-------+---------------+------+-----+---------+-------+
| Field | Type          | Null | Key | Default | Extra |
+-------+---------------+------+-----+---------+-------+
| id    | int           | YES  |     | NULL    |       |
| name  | varchar(100)  | YES  |     | NULL    |       |
| price | decimal(10,2) | YES  |     | NULL    |       |
| qty   | int           | YES  |     | NULL    |       |
+-------+---------------+------+-----+---------+-------+
4 rows in set (0.03 sec)

mysql> select * from products;
+------+--------------+--------+------+
| id   | name         | price  | qty  |
+------+--------------+--------+------+
|    1 | Pen          |  10.00 |  100 |
|    2 | Notebook     |  25.00 |   50 |
|    3 | Pencil       |   5.00 |  200 |
|    4 | Eraser       |   3.00 |  300 |
|    5 | Marker       |  15.00 |   80 |
|    6 | Scale        |  20.00 |  150 |
|    7 | Sharpener    |   8.00 |  120 |
|    8 | Geometry Box | 120.00 |   40 |
|    9 | Sketch Pen   |  60.00 |   75 |
|   10 | Crayons      |  90.00 |   55 |
+------+--------------+--------+------+
10 rows in set (0.00 sec)

mysql> select name,price,price+(price*0.12) as price_with_tax from products;
+--------------+--------+----------------+
| name         | price  | price_with_tax |
+--------------+--------+----------------+
| Pen          |  10.00 |        11.2000 |
| Notebook     |  25.00 |        28.0000 |
| Pencil       |   5.00 |         5.6000 |
| Eraser       |   3.00 |         3.3600 |
| Marker       |  15.00 |        16.8000 |
| Scale        |  20.00 |        22.4000 |
| Sharpener    |   8.00 |         8.9600 |
| Geometry Box | 120.00 |       134.4000 |
| Sketch Pen   |  60.00 |        67.2000 |
| Crayons      |  90.00 |       100.8000 |
+--------------+--------+----------------+
10 rows in set (0.00 sec)

mysql> select price,price-(price-5) as price from prodcts;
ERROR 1146 (42S02): Table 'da6.prodcts' doesn't exist
mysql> select name,price,(price-5) as price from products;
+--------------+--------+--------+
| name         | price  | price  |
+--------------+--------+--------+
| Pen          |  10.00 |   5.00 |
| Notebook     |  25.00 |  20.00 |
| Pencil       |   5.00 |   0.00 |
| Eraser       |   3.00 |  -2.00 |
| Marker       |  15.00 |  10.00 |
| Scale        |  20.00 |  15.00 |
| Sharpener    |   8.00 |   3.00 |
| Geometry Box | 120.00 | 115.00 |
| Sketch Pen   |  60.00 |  55.00 |
| Crayons      |  90.00 |  85.00 |
+--------------+--------+--------+
10 rows in set (0.04 sec)

mysql> select name,price,(price*quantity) from products;
ERROR 1054 (42S22): Unknown column 'quantity' in 'field list'
mysql> select name,price,(price-5) as discounted-price from products;
ERROR 1064 (42000): You have an error in your SQL syntax; check the manual that corresponds to your MySQL server version for the right syntax to use near '-price from products' at line 1
mysql> select name,price,price-5 as discounted_price from products;
+--------------+--------+------------------+
| name         | price  | discounted_price |
+--------------+--------+------------------+
| Pen          |  10.00 |             5.00 |
| Notebook     |  25.00 |            20.00 |
| Pencil       |   5.00 |             0.00 |
| Eraser       |   3.00 |            -2.00 |
| Marker       |  15.00 |            10.00 |
| Scale        |  20.00 |            15.00 |
| Sharpener    |   8.00 |             3.00 |
| Geometry Box | 120.00 |           115.00 |
| Sketch Pen   |  60.00 |            55.00 |
| Crayons      |  90.00 |            85.00 |
+--------------+--------+------------------+
10 rows in set (0.00 sec)

mysql> select name,price,quantity,price*quantity as inventory_price from products;
ERROR 1054 (42S22): Unknown column 'quantity' in 'field list'
mysql> select name,price,qty,price*qty as inventory_price from products;
+--------------+--------+------+-----------------+
| name         | price  | qty  | inventory_price |
+--------------+--------+------+-----------------+
| Pen          |  10.00 |  100 |         1000.00 |
| Notebook     |  25.00 |   50 |         1250.00 |
| Pencil       |   5.00 |  200 |         1000.00 |
| Eraser       |   3.00 |  300 |          900.00 |
| Marker       |  15.00 |   80 |         1200.00 |
| Scale        |  20.00 |  150 |         3000.00 |
| Sharpener    |   8.00 |  120 |          960.00 |
| Geometry Box | 120.00 |   40 |         4800.00 |
| Sketch Pen   |  60.00 |   75 |         4500.00 |
| Crayons      |  90.00 |   55 |         4950.00 |
+--------------+--------+------+-----------------+
10 rows in set (0.00 sec)

mysql> select name,price,qty,price*10 as price_for_10_units from products;
+--------------+--------+------+--------------------+
| name         | price  | qty  | price_for_10_units |
+--------------+--------+------+--------------------+
| Pen          |  10.00 |  100 |             100.00 |
| Notebook     |  25.00 |   50 |             250.00 |
| Pencil       |   5.00 |  200 |              50.00 |
| Eraser       |   3.00 |  300 |              30.00 |
| Marker       |  15.00 |   80 |             150.00 |
| Scale        |  20.00 |  150 |             200.00 |
| Sharpener    |   8.00 |  120 |              80.00 |
| Geometry Box | 120.00 |   40 |            1200.00 |
| Sketch Pen   |  60.00 |   75 |             600.00 |
| Crayons      |  90.00 |   55 |             900.00 |
+--------------+--------+------+--------------------+
10 rows in set (0.00 sec)

mysql> select * from produts where qty%50!=0;
ERROR 1146 (42S02): Table 'da6.produts' doesn't exist
mysql> select * from produts where qty % 50 !=0;
ERROR 1146 (42S02): Table 'da6.produts' doesn't exist
mysql> select * from products where qty%50!=0;
+------+--------------+--------+------+
| id   | name         | price  | qty  |
+------+--------------+--------+------+
|    5 | Marker       |  15.00 |   80 |
|    7 | Sharpener    |   8.00 |  120 |
|    8 | Geometry Box | 120.00 |   40 |
|    9 | Sketch Pen   |  60.00 |   75 |
|   10 | Crayons      |  90.00 |   55 |
+------+--------------+--------+------+
5 rows in set (0.01 sec)

mysql> select * from products where qty%50<>0;
+------+--------------+--------+------+
| id   | name         | price  | qty  |
+------+--------------+--------+------+
|    5 | Marker       |  15.00 |   80 |
|    7 | Sharpener    |   8.00 |  120 |
|    8 | Geometry Box | 120.00 |   40 |
|    9 | Sketch Pen   |  60.00 |   75 |
|   10 | Crayons      |  90.00 |   55 |
+------+--------------+--------+------+
5 rows in set (0.00 sec)

mysql> select * from products add 2 units to all products;
ERROR 1064 (42000): You have an error in your SQL syntax; check the manual that corresponds to your MySQL server version for the right syntax to use near 'add 2 units to all products' at line 1
mysql> add 2 units to all products;
ERROR 1064 (42000): You have an error in your SQL syntax; check the manual that corresponds to your MySQL server version for the right syntax to use near 'add 2 units to all products' at line 1
mysql> select name,price,qty,price+2 as inventory_price from products;
+--------------+--------+------+-----------------+
| name         | price  | qty  | inventory_price |
+--------------+--------+------+-----------------+
| Pen          |  10.00 |  100 |           12.00 |
| Notebook     |  25.00 |   50 |           27.00 |
| Pencil       |   5.00 |  200 |            7.00 |
| Eraser       |   3.00 |  300 |            5.00 |
| Marker       |  15.00 |   80 |           17.00 |
| Scale        |  20.00 |  150 |           22.00 |
| Sharpener    |   8.00 |  120 |           10.00 |
| Geometry Box | 120.00 |   40 |          122.00 |
| Sketch Pen   |  60.00 |   75 |           62.00 |
| Crayons      |  90.00 |   55 |           92.00 |
+--------------+--------+------+-----------------+
10 rows in set (0.00 sec)

mysql> update products set qty=qty+2;
Query OK, 10 rows affected (0.02 sec)
Rows matched: 10  Changed: 10  Warnings: 0

mysql> select * from products;
+------+--------------+--------+------+
| id   | name         | price  | qty  |
+------+--------------+--------+------+
|    1 | Pen          |  10.00 |  102 |
|    2 | Notebook     |  25.00 |   52 |
|    3 | Pencil       |   5.00 |  202 |
|    4 | Eraser       |   3.00 |  302 |
|    5 | Marker       |  15.00 |   82 |
|    6 | Scale        |  20.00 |  152 |
|    7 | Sharpener    |   8.00 |  122 |
|    8 | Geometry Box | 120.00 |   42 |
|    9 | Sketch Pen   |  60.00 |   77 |
|   10 | Crayons      |  90.00 |   57 |
+------+--------------+--------+------+
10 rows in set (0.00 sec)

mysql> update products set price=price-5;
Query OK, 10 rows affected (0.01 sec)
Rows matched: 10  Changed: 10  Warnings: 0

mysql> select * from products;
+------+--------------+--------+------+
| id   | name         | price  | qty  |
+------+--------------+--------+------+
|    1 | Pen          |   5.00 |  102 |
|    2 | Notebook     |  20.00 |   52 |
|    3 | Pencil       |   0.00 |  202 |
|    4 | Eraser       |  -2.00 |  302 |
|    5 | Marker       |  10.00 |   82 |
|    6 | Scale        |  15.00 |  152 |
|    7 | Sharpener    |   3.00 |  122 |
|    8 | Geometry Box | 115.00 |   42 |
|    9 | Sketch Pen   |  55.00 |   77 |
|   10 | Crayons      |  85.00 |   57 |
+------+--------------+--------+------+
10 rows in set (0.00 sec)

mysql>
mysql> update products set qty=qty*2 where name='eraser';
Query OK, 1 row affected (0.01 sec)
Rows matched: 1  Changed: 1  Warnings: 0

mysql> select * from products;
+------+--------------+--------+------+
| id   | name         | price  | qty  |
+------+--------------+--------+------+
|    1 | Pen          |   5.00 |  102 |
|    2 | Notebook     |  20.00 |   52 |
|    3 | Pencil       |   0.00 |  202 |
|    4 | Eraser       |  -2.00 |  604 |
|    5 | Marker       |  10.00 |   82 |
|    6 | Scale        |  15.00 |  152 |
|    7 | Sharpener    |   3.00 |  122 |
|    8 | Geometry Box | 115.00 |   42 |
|    9 | Sketch Pen   |  55.00 |   77 |
|   10 | Crayons      |  85.00 |   57 |
+------+--------------+--------+------+
10 rows in set (0.00 sec)

mysql> update products set qty=qty/2 where name ='marker';
Query OK, 1 row affected (0.01 sec)
Rows matched: 1  Changed: 1  Warnings: 0

mysql> select * from products;
+------+--------------+--------+------+
| id   | name         | price  | qty  |
+------+--------------+--------+------+
|    1 | Pen          |   5.00 |  102 |
|    2 | Notebook     |  20.00 |   52 |
|    3 | Pencil       |   0.00 |  202 |
|    4 | Eraser       |  -2.00 |  604 |
|    5 | Marker       |  10.00 |   41 |
|    6 | Scale        |  15.00 |  152 |
|    7 | Sharpener    |   3.00 |  122 |
|    8 | Geometry Box | 115.00 |   42 |
|    9 | Sketch Pen   |  55.00 |   77 |
|   10 | Crayons      |  85.00 |   57 |
+------+--------------+--------+------+
10 rows in set (0.00 sec)

mysql> STEP 1: Create Table
    -> CREATE TABLE StudentScores (
    ->  id INT,
    ->  name VARCHAR(100),
    ->  subject VARCHAR(50),
    ->  marks INT
    ->  );
ERROR 1064 (42000): You have an error in your SQL syntax; check the manual that corresponds to your MySQL server version for the right syntax to use near 'STEP 1: Create Table
CREATE TABLE StudentScores (
 id INT,
 name VARCHAR(100),
 ' at line 1
mysql>
mysql> -- STEP 2: Insert Records
mysql> INSERT INTO StudentScores VALUES
    ->  (1, 'Alice', 'Math', 95),
    ->  (2, 'Bob', 'Math', 76),
    ->  (3, 'Charlie', 'Math', 59),
    ->  (4, 'Diana', 'Math', 88),
    ->  (5, 'Eve', 'Math', 40),
    ->  (6, 'Frank', 'Math', 95),
    ->  (7, 'Grace', 'Science', 67),
    ->  (8, 'Henry', 'Science', 82),
    ->  (9, 'Ivy', 'English', 91),
    ->  (10, 'Jack', 'English', 55),
    ->  (11, 'Kevin', 'Math', 73),
    ->  (12, 'Lily', 'Science', 48),
    ->  (13, 'Mia', 'English', 100),
    ->  (14, 'Noah', 'Math', 64),
    ->  (15, 'Olivia', 'Science', 79);
ERROR 1146 (42S02): Table 'da6.studentscores' doesn't exist
mysql> select*from students scores;
ERROR 1146 (42S02): Table 'da6.students' doesn't exist
mysql> STEP 1: Create Table
    -> CREATE TABLE StudentScores (
    ->  id INT,
    ->  name VARCHAR(100),
    ->  subject VARCHAR(50),
    ->  marks INT
    ->  );
ERROR 1064 (42000): You have an error in your SQL syntax; check the manual that corresponds to your MySQL server version for the right syntax to use near 'STEP 1: Create Table
CREATE TABLE StudentScores (
 id INT,
 name VARCHAR(100),
 ' at line 1
mysql>
mysql> -- STEP 2: Insert Records
mysql> INSERT INTO StudentScores VALUES
    ->  (1, 'Alice', 'Math', 95),
    ->  (2, 'Bob', 'Math', 76),
    ->  (3, 'Charlie', 'Math', 59),
    ->  (4, 'Diana', 'Math', 88),
    ->  (5, 'Eve', 'Math', 40),
    ->  (6, 'Frank', 'Math', 95),
    ->  (7, 'Grace', 'Science', 67),
    ->  (8, 'Henry', 'Science', 82),
    ->  (9, 'Ivy', 'English', 91),
    ->  (10, 'Jack', 'English', 55),
    ->  (11, 'Kevin', 'Math', 73),
    ->  (12, 'Lily', 'Science', 48),
    ->  (13, 'Mia', 'English', 100),
    ->  (14, 'Noah', 'Math', 64),
    ->  (15, 'Olivia', 'Science', 79);
ERROR 1146 (42S02): Table 'da6.studentscores' doesn't exist
mysql> use da6;
Database changed
mysql> STEP 1: Create Table
    -> CREATE TABLE StudentScores (
    ->  id INT,
    ->  name VARCHAR(100),
    ->  subject VARCHAR(50),
    ->  marks INT
    ->  );
ERROR 1064 (42000): You have an error in your SQL syntax; check the manual that corresponds to your MySQL server version for the right syntax to use near 'STEP 1: Create Table
CREATE TABLE StudentScores (
 id INT,
 name VARCHAR(100),
 ' at line 1
mysql>
mysql> -- STEP 2: Insert Records
mysql> INSERT INTO StudentScores VALUES
    ->  (1, 'Alice', 'Math', 95),
    ->  (2, 'Bob', 'Math', 76),
    ->  (3, 'Charlie', 'Math', 59),
    ->  (4, 'Diana', 'Math', 88),
    ->  (5, 'Eve', 'Math', 40),
    ->  (6, 'Frank', 'Math', 95),
    ->  (7, 'Grace', 'Science', 67),
    ->  (8, 'Henry', 'Science', 82),
    ->  (9, 'Ivy', 'English', 91),
    ->  (10, 'Jack', 'English', 55),
    ->  (11, 'Kevin', 'Math', 73),
    ->  (12, 'Lily', 'Science', 48),
    ->  (13, 'Mia', 'English', 100),
    ->  (14, 'Noah', 'Math', 64),
    -> ^C15, 'Olivia', 'Science', 79);
mysql> ^C
mysql> CREATE TABLE StudentScores (
    ->  id INT,
    ->  name VARCHAR(100),
    ->  subject VARCHAR(50),
    ->  marks INT
    ->  );
Query OK, 0 rows affected (0.31 sec)

mysql> INSERT INTO StudentScores VALUES
    ->  (1, 'Alice', 'Math', 95),
    ->  (2, 'Bob', 'Math', 76),
    ->  (3, 'Charlie', 'Math', 59),
    ->  (4, 'Diana', 'Math', 88),
    ->  (5, 'Eve', 'Math', 40),
    ->  (6, 'Frank', 'Math', 95),
    ->  (7, 'Grace', 'Science', 67),
    ->  (8, 'Henry', 'Science', 82),
    ->  (9, 'Ivy', 'English', 91),
    ->  (10, 'Jack', 'English', 55),
    ->  (11, 'Kevin', 'Math', 73),
    ->  (12, 'Lily', 'Science', 48),
    ->  (13, 'Mia', 'English', 100),
    ->  (14, 'Noah', 'Math', 64),
    ->  (15, 'Olivia', 'Science', 79);
Query OK, 15 rows affected (0.01 sec)
Records: 15  Duplicates: 0  Warnings: 0

mysql> select * from students;
ERROR 1146 (42S02): Table 'da6.students' doesn't exist
mysql> select * from studentscores;
+------+---------+---------+-------+
| id   | name    | subject | marks |
+------+---------+---------+-------+
|    1 | Alice   | Math    |    95 |
|    2 | Bob     | Math    |    76 |
|    3 | Charlie | Math    |    59 |
|    4 | Diana   | Math    |    88 |
|    5 | Eve     | Math    |    40 |
|    6 | Frank   | Math    |    95 |
|    7 | Grace   | Science |    67 |
|    8 | Henry   | Science |    82 |
|    9 | Ivy     | English |    91 |
|   10 | Jack    | English |    55 |
|   11 | Kevin   | Math    |    73 |
|   12 | Lily    | Science |    48 |
|   13 | Mia     | English |   100 |
|   14 | Noah    | Math    |    64 |
|   15 | Olivia  | Science |    79 |
+------+---------+---------+-------+
15 rows in set (0.00 sec)

mysql> select * from studentscores >80;
ERROR 1064 (42000): You have an error in your SQL syntax; check the manual that corresponds to your MySQL server version for the right syntax to use near '>80' at line 1
mysql> select * from studentscores> 80;
ERROR 1064 (42000): You have an error in your SQL syntax; check the manual that corresponds to your MySQL server version for the right syntax to use near '> 80' at line 1
mysql> select * from studentscores>=80;
ERROR 1064 (42000): You have an error in your SQL syntax; check the manual that corresponds to your MySQL server version for the right syntax to use near '>=80' at line 1
mysql> select * from studentscores => 80;
ERROR 1064 (42000): You have an error in your SQL syntax; check the manual that corresponds to your MySQL server version for the right syntax to use near '=> 80' at line 1
mysql> select * from studentscores where marks > 80;
+------+-------+---------+-------+
| id   | name  | subject | marks |
+------+-------+---------+-------+
|    1 | Alice | Math    |    95 |
|    4 | Diana | Math    |    88 |
|    6 | Frank | Math    |    95 |
|    8 | Henry | Science |    82 |
|    9 | Ivy   | English |    91 |
|   13 | Mia   | English |   100 |
+------+-------+---------+-------+
6 rows in set (0.01 sec)

mysql> select * from studentscores where marks > 60;
+------+--------+---------+-------+
| id   | name   | subject | marks |
+------+--------+---------+-------+
|    1 | Alice  | Math    |    95 |
|    2 | Bob    | Math    |    76 |
|    4 | Diana  | Math    |    88 |
|    6 | Frank  | Math    |    95 |
|    7 | Grace  | Science |    67 |
|    8 | Henry  | Science |    82 |
|    9 | Ivy    | English |    91 |
|   11 | Kevin  | Math    |    73 |
|   13 | Mia    | English |   100 |
|   14 | Noah   | Math    |    64 |
|   15 | Olivia | Science |    79 |
+------+--------+---------+-------+
11 rows in set (0.00 sec)

mysql> select * from studentscores where marks < 50;
+------+------+---------+-------+
| id   | name | subject | marks |
+------+------+---------+-------+
|    5 | Eve  | Math    |    40 |
|   12 | Lily | Science |    48 |
+------+------+---------+-------+
2 rows in set (0.00 sec)

mysql> select * from studentscores where marks >95;
+------+------+---------+-------+
| id   | name | subject | marks |
+------+------+---------+-------+
|   13 | Mia  | English |   100 |
+------+------+---------+-------+
1 row in set (0.00 sec)

mysql> select * from studentscores where marks < 95;
+------+---------+---------+-------+
| id   | name    | subject | marks |
+------+---------+---------+-------+
|    2 | Bob     | Math    |    76 |
|    3 | Charlie | Math    |    59 |
|    4 | Diana   | Math    |    88 |
|    5 | Eve     | Math    |    40 |
|    7 | Grace   | Science |    67 |
|    8 | Henry   | Science |    82 |
|    9 | Ivy     | English |    91 |
|   10 | Jack    | English |    55 |
|   11 | Kevin   | Math    |    73 |
|   12 | Lily    | Science |    48 |
|   14 | Noah    | Math    |    64 |
|   15 | Olivia  | Science |    79 |
+------+---------+---------+-------+
12 rows in set (0.00 sec)

mysql> select * from studentscores where marks != 95;
+------+---------+---------+-------+
| id   | name    | subject | marks |
+------+---------+---------+-------+
|    2 | Bob     | Math    |    76 |
|    3 | Charlie | Math    |    59 |
|    4 | Diana   | Math    |    88 |
|    5 | Eve     | Math    |    40 |
|    7 | Grace   | Science |    67 |
|    8 | Henry   | Science |    82 |
|    9 | Ivy     | English |    91 |
|   10 | Jack    | English |    55 |
|   11 | Kevin   | Math    |    73 |
|   12 | Lily    | Science |    48 |
|   13 | Mia     | English |   100 |
|   14 | Noah    | Math    |    64 |
|   15 | Olivia  | Science |    79 |
+------+---------+---------+-------+
13 rows in set (0.00 sec)

mysql> select * from studentscores where marks <= 60;
+------+---------+---------+-------+
| id   | name    | subject | marks |
+------+---------+---------+-------+
|    3 | Charlie | Math    |    59 |
|    5 | Eve     | Math    |    40 |
|   10 | Jack    | English |    55 |
|   12 | Lily    | Science |    48 |
+------+---------+---------+-------+
4 rows in set (0.00 sec)

mysql> update studentscores where marks,marks+10, marks < 50;
ERROR 1064 (42000): You have an error in your SQL syntax; check the manual that corresponds to your MySQL server version for the right syntax to use near 'where marks,marks+10, marks < 50' at line 1
mysql> select * from studentscores where marks < 60;
+------+---------+---------+-------+
| id   | name    | subject | marks |
+------+---------+---------+-------+
|    3 | Charlie | Math    |    59 |
|    5 | Eve     | Math    |    40 |
|   10 | Jack    | English |    55 |
|   12 | Lily    | Science |    48 |
+------+---------+---------+-------+
4 rows in set (0.00 sec)

mysql> update studentscores where marks,marks+10;
ERROR 1064 (42000): You have an error in your SQL syntax; check the manual that corresponds to your MySQL server version for the right syntax to use near 'where marks,marks+10' at line 1
mysql> update studentscores where marks+10;
ERROR 1064 (42000): You have an error in your SQL syntax; check the manual that corresponds to your MySQL server version for the right syntax to use near 'where marks+10' at line 1
mysql> select * from studentscores where marks <= 60;
+------+---------+---------+-------+
| id   | name    | subject | marks |
+------+---------+---------+-------+
|    3 | Charlie | Math    |    59 |
|    5 | Eve     | Math    |    40 |
|   10 | Jack    | English |    55 |
|   12 | Lily    | Science |    48 |
+------+---------+---------+-------+
4 rows in set (0.00 sec)

mysql> update studentscores set marks=marks+10 where marks<=60;
Query OK, 4 rows affected (0.02 sec)
Rows matched: 4  Changed: 4  Warnings: 0

mysql> select * from studentscores;
+------+---------+---------+-------+
| id   | name    | subject | marks |
+------+---------+---------+-------+
|    1 | Alice   | Math    |    95 |
|    2 | Bob     | Math    |    76 |
|    3 | Charlie | Math    |    69 |
|    4 | Diana   | Math    |    88 |
|    5 | Eve     | Math    |    50 |
|    6 | Frank   | Math    |    95 |
|    7 | Grace   | Science |    67 |
|    8 | Henry   | Science |    82 |
|    9 | Ivy     | English |    91 |
|   10 | Jack    | English |    65 |
|   11 | Kevin   | Math    |    73 |
|   12 | Lily    | Science |    58 |
|   13 | Mia     | English |   100 |
|   14 | Noah    | Math    |    64 |
|   15 | Olivia  | Science |    79 |
+------+---------+---------+-------+
15 rows in set (0.00 sec)

mysql> update studentscores set marks=marks+10 where marks<=60;
Query OK, 2 rows affected (0.01 sec)
Rows matched: 2  Changed: 2  Warnings: 0

mysql> update studentscores set marks=marks+5 where < 60;
ERROR 1064 (42000): You have an error in your SQL syntax; check the manual that corresponds to your MySQL server version for the right syntax to use near '< 60' at line 1
mysql> update studentscores set marks=marks+5 where marks < 60;
Query OK, 0 rows affected (0.00 sec)
Rows matched: 0  Changed: 0  Warnings: 0

mysql> update studentscores set marks=marks+10 where marks<=50;
Query OK, 0 rows affected (0.00 sec)
Rows matched: 0  Changed: 0  Warnings: 0

mysql> update studentscores set marks=marks+5 where marks < 60;
Query OK, 0 rows affected (0.00 sec)
Rows matched: 0  Changed: 0  Warnings: 0

mysql> update studentscores set marks=marks+2 where marks < 90;
Query OK, 11 rows affected (0.01 sec)
Rows matched: 11  Changed: 11  Warnings: 0

mysql> update studentscores set marks=marks+3 where marks >= 80;
Query OK, 7 rows affected (0.01 sec)
Rows matched: 7  Changed: 7  Warnings: 0

mysql> update studentscores set marks=marks-1 where marks >= 95
    -> update studentscores set marks=marks-1 where marks >= 95;
ERROR 1064 (42000): You have an error in your SQL syntax; check the manual that corresponds to your MySQL server version for the right syntax to use near 'update studentscores set marks=marks-1 where marks >= 95' at line 2
mysql> ^C
mysql> delete studentscores <=50;
ERROR 1064 (42000): You have an error in your SQL syntax; check the manual that corresponds to your MySQL server version for the right syntax to use near '<=50' at line 1
mysql> select * from studentscores;
+------+---------+---------+-------+
| id   | name    | subject | marks |
+------+---------+---------+-------+
|    1 | Alice   | Math    |    98 |
|    2 | Bob     | Math    |    78 |
|    3 | Charlie | Math    |    71 |
|    4 | Diana   | Math    |    93 |
|    5 | Eve     | Math    |    62 |
|    6 | Frank   | Math    |    98 |
|    7 | Grace   | Science |    69 |
|    8 | Henry   | Science |    87 |
|    9 | Ivy     | English |    94 |
|   10 | Jack    | English |    67 |
|   11 | Kevin   | Math    |    75 |
|   12 | Lily    | Science |    70 |
|   13 | Mia     | English |   103 |
|   14 | Noah    | Math    |    66 |
|   15 | Olivia  | Science |    84 |
+------+---------+---------+-------+
15 rows in set (0.00 sec)

mysql> delete from studentscores where marks<50;
Query OK, 0 rows affected (0.01 sec)

mysql> select * from studentscores;
+------+---------+---------+-------+
| id   | name    | subject | marks |
+------+---------+---------+-------+
|    1 | Alice   | Math    |    98 |
|    2 | Bob     | Math    |    78 |
|    3 | Charlie | Math    |    71 |
|    4 | Diana   | Math    |    93 |
|    5 | Eve     | Math    |    62 |
|    6 | Frank   | Math    |    98 |
|    7 | Grace   | Science |    69 |
|    8 | Henry   | Science |    87 |
|    9 | Ivy     | English |    94 |
|   10 | Jack    | English |    67 |
|   11 | Kevin   | Math    |    75 |
|   12 | Lily    | Science |    70 |
|   13 | Mia     | English |   103 |
|   14 | Noah    | Math    |    66 |
|   15 | Olivia  | Science |    84 |
+------+---------+---------+-------+
15 rows in set (0.00 sec)

mysql> delete from studentscores where marks<50;
Query OK, 0 rows affected (0.00 sec)

mysql> delete from studentscores where marks=<60;
ERROR 1064 (42000): You have an error in your SQL syntax; check the manual that corresponds to your MySQL server version for the right syntax to use near '=<60' at line 1
mysql> delete from studentscores where marks<=60;
Query OK, 0 rows affected (0.00 sec)

mysql> delete from studentscores where marks>90;
Query OK, 5 rows affected (0.01 sec)

mysql> delete from studentscores where marks>=80;
Query OK, 2 rows affected (0.01 sec)

mysql> delete from studentscores where marks!=95;
Query OK, 8 rows affected (0.01 sec)

mysql> delete from studentscores where marks=76;
Query OK, 0 rows affected (0.00 sec)

mysql> select*from studentscores;
Empty set (0.00 sec)

mysql> drop employees ;
ERROR 1064 (42000): You have an error in your SQL syntax; check the manual that corresponds to your MySQL server version for the right syntax to use near 'employees' at line 1
mysql> ^C
mysql>
mysql> CREATE TABLE Employees (
    ->  id INT,
    ->  name VARCHAR(100),
    ->  department VARCHAR(100),
    ->  salary INT,
    ->  isactive BOOLEAN
    ->  );
ERROR 1050 (42S01): Table 'employees' already exists
mysql> drop table employees;
Query OK, 0 rows affected (0.05 sec)

mysql> CREATE TABLE Employees (
    ->  id INT,
    ->  name VARCHAR(100),
    ->  department VARCHAR(100),
    ->  salary INT,
    ->  isactive BOOLEAN
    ->  );
Query OK, 0 rows affected (0.03 sec)

mysql> INSERT INTO Employees VALUES
    ->  (1, 'Rahul Sharma', 'IT', 50000, TRUE),
    ->  (2, 'Priya Reddy', 'HR', 30000, TRUE),
    ->  (3, 'Amit Kumar', 'Finance', 45000, FALSE),
    ->  (4, 'Sneha Patel', 'IT', 35000, TRUE),
    ->  (5, 'Vikram Singh', 'Finance', 28000, TRUE),
    ->  (6, 'Anjali Mehta', 'HR', 32000, FALSE),
    ->  (7, 'Kiran Rao', 'IT', 60000, TRUE),
    ->  (8, 'Pooja Verma', 'Marketing', 27000, TRUE),
    ->  (9, 'Ramesh Naidu', 'Sales', 38000, TRUE),
    ->  (10, 'Deepika Joshi', 'Finance', 52000, TRUE),
    ->  (11, 'Suresh Babu', 'Marketing', 29000, FALSE),
    ->  (12, 'Neha Kapoor', 'HR', 41000, TRUE),
    ->  (13, 'Arjun Reddy', 'IT', 55000, FALSE),
    ->  (14, 'Lakshmi Devi', 'Sales', 33000, TRUE),
    ->  (15, 'Nikhil Jain', 'IT', 47000, TRUE);
Query OK, 15 rows affected (0.01 sec)
Records: 15  Duplicates: 0  Warnings: 0

mysql> select * from employees;
+------+---------------+------------+--------+----------+
| id   | name          | department | salary | isactive |
+------+---------------+------------+--------+----------+
|    1 | Rahul Sharma  | IT         |  50000 |        1 |
|    2 | Priya Reddy   | HR         |  30000 |        1 |
|    3 | Amit Kumar    | Finance    |  45000 |        0 |
|    4 | Sneha Patel   | IT         |  35000 |        1 |
|    5 | Vikram Singh  | Finance    |  28000 |        1 |
|    6 | Anjali Mehta  | HR         |  32000 |        0 |
|    7 | Kiran Rao     | IT         |  60000 |        1 |
|    8 | Pooja Verma   | Marketing  |  27000 |        1 |
|    9 | Ramesh Naidu  | Sales      |  38000 |        1 |
|   10 | Deepika Joshi | Finance    |  52000 |        1 |
|   11 | Suresh Babu   | Marketing  |  29000 |        0 |
|   12 | Neha Kapoor   | HR         |  41000 |        1 |
|   13 | Arjun Reddy   | IT         |  55000 |        0 |
|   14 | Lakshmi Devi  | Sales      |  33000 |        1 |
|   15 | Nikhil Jain   | IT         |  47000 |        1 |
+------+---------------+------------+--------+----------+
15 rows in set (0.00 sec)

mysql> select * from employees where department='it';
+------+--------------+------------+--------+----------+
| id   | name         | department | salary | isactive |
+------+--------------+------------+--------+----------+
|    1 | Rahul Sharma | IT         |  50000 |        1 |
|    4 | Sneha Patel  | IT         |  35000 |        1 |
|    7 | Kiran Rao    | IT         |  60000 |        1 |
|   13 | Arjun Reddy  | IT         |  55000 |        0 |
|   15 | Nikhil Jain  | IT         |  47000 |        1 |
+------+--------------+------------+--------+----------+
5 rows in set (0.00 sec)

mysql> select * from employees department='it'and salary>40000;
ERROR 1064 (42000): You have an error in your SQL syntax; check the manual that corresponds to your MySQL server version for the right syntax to use near '='it'and salary>40000' at line 1
mysql> select * from employees where department='it'and salary>40000;
+------+--------------+------------+--------+----------+
| id   | name         | department | salary | isactive |
+------+--------------+------------+--------+----------+
|    1 | Rahul Sharma | IT         |  50000 |        1 |
|    7 | Kiran Rao    | IT         |  60000 |        1 |
|   13 | Arjun Reddy  | IT         |  55000 |        0 |
|   15 | Nikhil Jain  | IT         |  47000 |        1 |
+------+--------------+------------+--------+----------+
4 rows in set (0.00 sec)

mysql> select * from employees where department='hr'and salary, 35000;
ERROR 1064 (42000): You have an error in your SQL syntax; check the manual that corresponds to your MySQL server version for the right syntax to use near ', 35000' at line 1
mysql> select * from employees where department='hr'and salary<35000;
+------+--------------+------------+--------+----------+
| id   | name         | department | salary | isactive |
+------+--------------+------------+--------+----------+
|    2 | Priya Reddy  | HR         |  30000 |        1 |
|    6 | Anjali Mehta | HR         |  32000 |        0 |
+------+--------------+------------+--------+----------+
2 rows in set (0.00 sec)

mysql> select * from employees where department='hr'not ;
ERROR 1064 (42000): You have an error in your SQL syntax; check the manual that corresponds to your MySQL server version for the right syntax to use near '' at line 1
mysql> select * from employees where department!=hr;
ERROR 1054 (42S22): Unknown column 'hr' in 'where clause'
mysql> select * from employees where department !='hr';
+------+---------------+------------+--------+----------+
| id   | name          | department | salary | isactive |
+------+---------------+------------+--------+----------+
|    1 | Rahul Sharma  | IT         |  50000 |        1 |
|    3 | Amit Kumar    | Finance    |  45000 |        0 |
|    4 | Sneha Patel   | IT         |  35000 |        1 |
|    5 | Vikram Singh  | Finance    |  28000 |        1 |
|    7 | Kiran Rao     | IT         |  60000 |        1 |
|    8 | Pooja Verma   | Marketing  |  27000 |        1 |
|    9 | Ramesh Naidu  | Sales      |  38000 |        1 |
|   10 | Deepika Joshi | Finance    |  52000 |        1 |
|   11 | Suresh Babu   | Marketing  |  29000 |        0 |
|   13 | Arjun Reddy   | IT         |  55000 |        0 |
|   14 | Lakshmi Devi  | Sales      |  33000 |        1 |
|   15 | Nikhil Jain   | IT         |  47000 |        1 |
+------+---------------+------------+--------+----------+
12 rows in set (0.00 sec)

mysql> select * from employees where department='finanace'and salary>30000;
Empty set (0.00 sec)

mysql> select * from employees where department='finanace'and salary<30000;
Empty set (0.00 sec)

mysql>
mysql> select * from employees where department='finanace'or salary>30000;
+------+---------------+------------+--------+----------+
| id   | name          | department | salary | isactive |
+------+---------------+------------+--------+----------+
|    1 | Rahul Sharma  | IT         |  50000 |        1 |
|    3 | Amit Kumar    | Finance    |  45000 |        0 |
|    4 | Sneha Patel   | IT         |  35000 |        1 |
|    6 | Anjali Mehta  | HR         |  32000 |        0 |
|    7 | Kiran Rao     | IT         |  60000 |        1 |
|    9 | Ramesh Naidu  | Sales      |  38000 |        1 |
|   10 | Deepika Joshi | Finance    |  52000 |        1 |
|   12 | Neha Kapoor   | HR         |  41000 |        1 |
|   13 | Arjun Reddy   | IT         |  55000 |        0 |
|   14 | Lakshmi Devi  | Sales      |  33000 |        1 |
|   15 | Nikhil Jain   | IT         |  47000 |        1 |
+------+---------------+------------+--------+----------+
11 rows in set (0.00 sec)

mysql> select * from employees where department='finanace'or(salary>30000 and isactive=true);
+------+---------------+------------+--------+----------+
| id   | name          | department | salary | isactive |
+------+---------------+------------+--------+----------+
|    1 | Rahul Sharma  | IT         |  50000 |        1 |
|    4 | Sneha Patel   | IT         |  35000 |        1 |
|    7 | Kiran Rao     | IT         |  60000 |        1 |
|    9 | Ramesh Naidu  | Sales      |  38000 |        1 |
|   10 | Deepika Joshi | Finance    |  52000 |        1 |
|   12 | Neha Kapoor   | HR         |  41000 |        1 |
|   14 | Lakshmi Devi  | Sales      |  33000 |        1 |
|   15 | Nikhil Jain   | IT         |  47000 |        1 |
+------+---------------+------------+--------+----------+
8 rows in set (0.00 sec)

mysql>